,keyword,views,likes,video_title,channel_name,video_id,published_at,summary,video_tags
371,water sports,122,0,Everyone Can Enjoy Water Sports,East Carolina University,22f8RLQqvJk,3 years ago,"Mitchell Cooper from Wilson, North Carolina organizes the Splash Bash Adaptive Water Sports Day to give people with disabilities the opportunity to enjoy water sports. He himself was injured and started wakeboarding at age 21, and now he is able to do things he never thought hed be able to again. The event brings joy to those who participate and makes them forget about their disabilities for a moment.","East Carolina University,North Carolina,Eastern Carolina,Greenville,Higher Education,Public Universities,UNC System,ECU,College,Students,Pirates,Purple,Gold"
372,ANews turkey,4831,31,Queens family among victims killed in deadly earthquake in Turkey,Eyewitness News ABC7NY,rG0BC4n1_lU,7 days ago,"A family of four from Queens, New York, has been confirmed to be among the victims killed in Turkeys powerful earthquake. The death toll has exceeded 15,000 people with most of them being in Turkey and the rest in Syria, and 62,000 have been injured.","news,turkey,earthquake,queens family,Burak Firik,queens family killed in turkey,turkey earthquake,Firik family,syria earthquake,syria,earthquake death toll,turkey earthquake death,earthquake in turkey,Council on American-Islamic Relations"
373,ANews turkey,2682,18999,Turkey Reporter Runs as Earthquake Aftershock Strikes,Inside Edition,gTvbjKj--_0,9 days ago,"Two powerful earthquakes, one measuring 7.8 and another measuring 3.8 on the Richter Scale, struck Turkey and neighbouring Syria, leaving around 10,000 people feared dead. The smaller earthquake in Buffalo, New York is unlikely to be related to the disaster in Turkey. Despite the small magnitude of the Buffalo quake, nerves were already frayed due to a blizzard that had previously killed 47 people.","earthquake,turkey,new York,Inside edition,inside_edition,ie newsdesk,new york,heroes,deadly,mother nature,death toll,aftershock,damage,apartment building,buffalo,debris,reporter,yuksel akalan,collapses,tv reporter,destruction,turkiye"
374,ANews turkey,2187,25,"More than 2,000 people killed in earthquake in Turkey",Eyewitness News ABC7NY,4IGJAQBbREo,10 days ago,"A 7.8 magnitude earthquake struck Turkey and Syria overnight, causing massive destruction and leaving hundreds of people dead. A second 7.9 magnitude earthquake hit the region shortly after, and the death toll is expected to rise. President Biden has directed U.S. aid and other government partners to assess response options, while dozens of countries have offered help in the effort to save lives.","news,earthquake,turkey,7.8 earthquake,international news,syria"
375,ANews turkey,1959,28,"Memorials to be held in NY, NJ for family killed in Turkey earthquake",Eyewitness News ABC7NY,CMLfei6nvYE,5 days ago,"A memorial service for the Queens family, who were killed in a disaster, will be held in Sunny Side. Barack and his wife were killed in a subsequent earthquake that followed the initial one. The younger sister talked about her loss during an appearance on CNN, expressing her grief for the loss of her family members. Meanwhile, Pattersons mayor will hold a vigil.",news
376,ANews turkey,1321,32,"‘Shaken Like A Cradle’: Earthquake Kills 640 In Turkey, Syria; Hunt On For Survivors",India Today,HzH23xqmE8s,10 days ago,"This transcript is about two people discussing the challenges of living in a foreign country. They talk about how difficult it can be to adjust to a new culture, language, and customs, as well as how their respective countries are different from each other and the things they miss from home.","india today,india today news,india today live,indian news live,india news live,english news,english news live,world news,china news,top news,sweden,quran burning,turkey news,latest news,international news,latest turkey news,protest in turkey,nato,nato membership,nato news,nato latest news"
377,ANews turkey,80,3125,Hundreds dead after earthquake strikes Turkey and Syria,CBS Mornings,67_L6qzGhEE,10 days ago,"A 7.8 magnitude earthquake has struck the border between Turkey and Syria, killing over 1300 people and causing massive destruction. Aftershocks have occurred and there are reports of it being felt up to 1000 miles away. The earthquake has caused immense suffering in an area that is already home to many people who have been displaced by war. The region is also experiencing a cold snow storm that is expected to last all week.","video,cbs,news,earthquake,turkey,syria,death toll,search and rescue,imtiaz tyab"
378,ANews turkey,62,2,"Turkish FM, NATO chief hold press conference",ANews,O5Z9ydLdH5w,9 hours ago,"At the defence ministerial meeting, NATO offered its condolences for the devastating earthquake that struck Turkey and Syria last week. In response, NATO deployed thousands of emergency responders to Turkey and provided financial aid as well as military aircraft from several countries. Ordinary citizens have also been raising money in support of Turkey.","International News,Global News,Turkey News,USA,UK,EU,Europe,Russia,China,Africa,Asia,Politics,Culture,Economy,Tourism,Middle East,News Live,Live News,24/7,Interviews,Analysts,Shorts,current events,breaking news,uk politics,us politics,Ukraine,Russia Ukraine,Nato,Joe Biden,Putin,International Daily News,Wion,RT,Zelensky,Daily News,War,news english,english news,news live,France 24,latest,top stories,BBC News,headlines,i24 news,DW english"
379,ANews turkey,28,5,Turkey determined to protect its rights / A News,ANews,v8xX6KkClLg,2 years ago,"Turkeys National Security Council announced that it will continue to protect its rights and interests in the Mediterranean without compromise. They also said that they will continue their fight against terrorism both inside and across the border, and provide military consultancy to Libyas legitimate government. They lauded Turkeys success in dealing with the coronavirus pandemic.",https://www.youtube.com/channel/UCKQhfw-lzz0uKnE1fY1PsAA
380,ANews turkey,8,0,"Turkeys Death Toll From Novel Coronavirus Outbreak Tops To 1,000 / A News",ANews,2UXSyhWgQlk,2 years ago,"At a scientific committee meeting chaired by Turkish Health Minister Ferritin Kuja, members exchanged views on how to prevent the spread of the novel coronavirus in Turkey. The death toll has risen to 1006 and 4747 out of 30,000 tests conducted have returned positive, bringing the total number of patients to 47,029. The government is taking measures such as closing schools and imposing curfews in order to try and limit the spread of the virus.","https://www.youtube.com/channel/UCKQhfw-lzz0uKnE1fY1PsAA,Coronavirus,turkey,death toll,Fahrettin Koca,Balkans,medical aid,protective gear,Spain,Italy,AID,coronavirus outbreak,Recep Tayyip Erdoğan,fight,president,covid-19,president erdogan,coronavirus,turkey covid-19,NEWS,ajans,news america,news live,news turkey"
381,ANews turkey,7,39,Turkey Sends Protective Gear To Spain And Italy / A News,ANews,JAXIVFSB5DQ,2 years ago,Turkey has taken the initiative to send medical equipment to Spain and Italy in order to assist them in their battle against the coronavirus pandemic. The Turkish government and President Recep Tayyip Erdoğan are collaborating with other world leaders to develop diplomatic measures for a global response to the virus.,"https://www.youtube.com/channel/UCKQhfw-lzz0uKnE1fY1PsAA,protective gear,turkey,Spain,Italy,AID,Coronavirus,coronavirus outbreak,Recep Tayyip Erdoğan,fight,president,covid-19,president erdogan,coronavirus,turkey covid-19"
382,BBC iPlayer,2906751,174848,Whats YOUR favourite chocolate? 🍫 #QI #iPlayer,BBC,PCD4dmjH4_c,2 months ago,"A survey was conducted in 2018 about peoples favorite Quality Street chocolates, finding that the two most popular choices were the purple ones and green triangles. The survey also found that these only appeared 5-6 times in a box, while they should appear 11 times. People had different preferences and opinions on the chocolates.","BBC iPlayer,United Kingdom,British TV,British TV Shows,Watch UK TV Online,Watch British TV Online,Watch British TV Shows Online"
383,BBC iPlayer,754792,22679,Cunk on Earth 🤣 Trailer - BBC,BBC,Hm6AOHq9OL4,4 months ago,"Philomena Conk invites viewers to join her on BBC iPlayer to learn about her venture, Venture Up Humanity. She poses questions such as What was the Soviet Union and Do we know if China has a roof in order to explore the world around us.","BBC iPlayer,United Kingdom,British TV,British TV Shows,Watch UK TV Online,Watch British TV Online,Watch British TV Shows Online"
384,BBC iPlayer,234838,72656,Posh family reacts to northern nanny | The Catherine Tate Show - BBC,BBC,g-BVgPeZR-Y,1 year ago,"Mommy has to arrange for an agency nanny to come around, and the nanny is from Newcastle or Sunderland. The nanny introduces herself as Gina and offers the children a milky brew and bickies, but she seems angry. Mommy tells the children not to provoke her and avoid looking her in the eye.","BBC iPlayer,United Kingdom,British TV,British TV Shows,Watch UK TV Online,Watch British TV Online,Watch British TV Shows Online"
385,BBC iPlayer,167683,674,How to watch BBC iPlayer without registering. Simple tip,Take me to the Geek,RzYrlWwyVsk,5 years ago,"In this transcript, it explains how to watch BBC iPlayer without registering and provides tips on how to bypass the registration process. It also mentions that a TV licence is needed in order to watch content on the platform. The video encourages viewers to like, subscribe and share if they enjoyed it.","How to watch bbc iplayer without registering,watch bbc iplayer using a vpn,best vpn for iplayer,dont register with bbc iplaer,watch bbc iplayer without registering,i dont want to register with bbc"
386,BBC iPlayer,549,409,The Gold | Trailer - BBC,BBC,gShXixufXqY,1 month ago,"Six robbers have stolen almost three tons of gold, and it is likely to find its way to people ready to handle it. The gold is being moved rapidly and will eventually all be gone. There is a race on to try and find the robbers and the gold before its too late.","BBC iPlayer,United Kingdom,British TV,British TV Shows,Watch UK TV Online,Watch British TV Online,Watch British TV Shows Online"
387,BBC iPlayer,549,256,New for 2023 on iPlayer 🔥 | BBC,BBC,y1jlA8sWjK8,2 months ago,"This transcript is about a group of people looking for six robbers and three tons of gold. Although the situation is dangerous, they are looking to the future and hoping to become something new in 2023.","BBC iPlayer,United Kingdom,British TV,British TV Shows,Watch UK TV Online,Watch British TV Online,Watch British TV Shows Online"
388,BBC iPlayer,540,256,New for 2023 on iPlayer 🔥 | BBC,BBC,y1jlA8sWjK8,2 months ago,"This transcript is about a group of people searching for six robbers and three tons of gold. They are looking to the future and are aware that this could be dangerous. One person confesses to something they didnt do, hoping to create something new in 2023 on BBC iPlayer.","BBC iPlayer,United Kingdom,British TV,British TV Shows,Watch UK TV Online,Watch British TV Online,Watch British TV Shows Online"
389,BBC iPlayer,527,252,Wild Isles 🦋🍄 | Trailer - BBC,BBC,C-KcTje9sMk,2 hours ago,This transcript describes a place full of astonishing nature that rivals anything seen elsewhere. It is close to home and offers dramatic and beautiful sights.,"BBC iPlayer,United Kingdom,British TV,British TV Shows,Watch UK TV Online,Watch British TV Online,Watch British TV Shows Online,Wild Isles,David Attenborough,Documentary,Wildlife,UK,Nature"
390,Vox.com,1121747,82696,The surprising reason we call each other guys #shorts,Vox,eUvBuD5MjrQ,3 months ago,"Guy is a term which originated from Guy Fox, an unsuccessful assassin who tried to blow up part of the British Parliament in 1605. In the 1800s, it was used as a slang insult in the UK, but over time its negative connotations have faded away and it is now commonly used to refer to anyone without the original story behind it.","vox.com,vox,explain,vox coleman lowndes,guy fawkes,fifth of november,november 5th,v for vendetta,etymology,guys,history,guy,slang,british slang,guy fawkes day,remember remember,the fifth of november,gunpower treason,british parliament,gunpowder plot,treason,what is guy fawkes day"
391,Vox.com,289936,16171,"The US House Speaker drama, explained #shorts",Vox,oxgsOxc3_Q8,1 month ago,"The US House of Representatives is currently unable to swear in any of its members due to a lack of a Speaker. Republicans technically have a majority, however, their far right faction are refusing to vote for the current Republican leader, Kevin McCarthy. Despite 11 votes, there is still no elected Speaker, and the fate of the incoming Congress may be determined by this small right-wing faction.","vox.com,vox,explain,house speaker,house of representatives,congress,us politics,politics,policy,kevin mccarthy,republicans,gop,democrats,voting,us government,senate,far-right,GOP republicans"
392,Vox.com,248128,16279,Are yams really sweet potatoes?,Vox,mm5Diw7Bpws,2 months ago,"Most Americans have never eaten a real yam, which are not commercially grown in the US. The word yam was likely derived from a West African word and 90% of them are now grown in West Africa, where theyve been a staple food for thousands of years. During enslavement, West African people likely used the word yam for sweet potatoes found in the new world.","vox.com,vox,explain,shorts,sweet potato,yam,thanksgiving,food"
393,Vox.com,247838,12779,How Syrias dictator blocked aid to earthquake victims,Vox,iTq08hvG7zM,4 days ago,"The region in Syria controlled by opposition forces has been receiving limited aid since 2014, with the majority of it coming through one border crossing. In 2020, Russia closed three of the routes, exacerbating an already dire situation when an earthquake struck in February 2021. Though two crossings have been temporarily reopened, the delay in aid has caused more suffering and death to a region that is already dealing with the effects of a civil war.","vox.com,vox,explain,vox shorts,vox rajaa elidrissi,syria,turkey,syria aid,syria earthquake,turkey-syria earthquake,syrian refugees,syrian civil war,bashar al-assad,al-assad,humanitarian aid,where does aid go"
394,Vox.com,113866,4358,Do crosswalk buttons actually work? #shorts,Vox,6ex2_u6YZzE,5 days ago,"Crosswalk buttons have become largely obsolete as cities update their traffic systems, with only a small percentage of buttons actually influencing the traffic signals. However, some buttons do still change traffic patterns or trigger audio cues for people with visual impairments.","vox.com,vox,explain,vox halley brown,pedestrians,pedestrian safety,roads,crosswalks,push button,crosswalk button,crosswalk push button,crossing the street,j walking,road safety,road design,countdown"
395,BABYMONSTER,1140957,772674,YG NEXT MOVEMENT,YG ENTERTAINMENT,rYyUpQ_veL4,1 month ago,"YG Executive Producer Yang Hyun Suk has announced the new group BABYMONSTER, composed of 7 talented members. Each of them have amazing skills with facial expressions, gestures and determination that is hard to find in Korea. BLACKPINKs Lisa and Jennie have praised their overall performance, and Yang Hyun Suk hopes they become stars that will shock the world.","YG Entertainment,YG 와이지,케이팝,K pop,K-pop"
396,BABYMONSTER,1140957,472118,BABYMONSTER - Dance Performance,YG ENTERTAINMENT,ly-p1Ve_RKQ,1 month ago,This is a conversation about being able to see and sing foreign things soon. Everyone was laughing at the end.,"YG Entertainment,YG 와이지,케이팝,K pop,K-pop"
397,BABYMONSTER,1140957,408682,BABYMONSTER (#2) - AHYEON (Live Performance),YG ENTERTAINMENT,ysJCTCQYJyg,1 month ago,"This transcript is of someone laughing after they said My monster, my time - likely in response to something humorous.","YG Entertainment,YG 와이지,케이팝,K pop,K-pop"
398,BABYMONSTER,1140957,337823,BABYMONSTER (#4) - ASA (Live Performance),YG ENTERTAINMENT,SlGkck6xWWI,4 weeks ago,"This transcript is a mixture of foreign language and laughter, likely indicating a comedic moment.","YG Entertainment,YG 와이지,케이팝,K pop,K-pop"
399,BABYMONSTER,1140957,64371,BABYMONSTER - ASAㅣCharacter Playlist,BABYMONSTER,WbtrLUNEc-U,1 day ago,"A group of people discuss ideas for a signature pose, and eventually decide on a triple heart. They then proceed to joke around, comparing each others beauty, before settling on their respective attractive features and saying goodbye.","BABYMONSTER,베이비몬스터,베몬,BABYMON,BAEMON,하람,아현,루카,치키타,파리타,로라,아사,HARAM,AHYEON,RUKA,CHIQUITA,PHARITA,RORA,ASA"
400,BABYMONSTER,1136434,461127,BABYMONSTER (#1) - HARAM (Live Performance),YG ENTERTAINMENT,aVsAVYDYhFI,1 month ago,"Two people express their love for each other, and a commitment to remain together despite the unknowns and challenges that life may bring.","YG Entertainment,YG 와이지,케이팝,K pop,K-pop"
401,BABYMONSTER,1136434,234943,BABYMONSTER (#7) - RUKA (Live Performance),YG ENTERTAINMENT,rCN3xgEPEwo,2 weeks ago,"The speaker is looking for a bad boy to make her feel good, and she is determined to find one despite the opinions of others. She mentions koalas as an example.","YG Entertainment,YG 와이지,케이팝,K pop,K-pop"
402,BABYMONSTER,1133114,423408,BABYMONSTER (#3) - CHIQUITA (Live Performance),YG ENTERTAINMENT,_9GF5oklUNs,1 month ago,"The speaker reflects on how someone used to be the strongest but now they are not, and how they waited for them for so long. The response is laughter.","YG Entertainment,YG 와이지,케이팝,K pop,K-pop"
403,BABYMONSTER,4360,20,Baby Monster’s Asa had shocked fans with her special speech. What’s the problem??,K-World Things,gzgFy-U1Cw8,16 hours ago,"Recently, Baby Monsters newest member Asa amazed fans by introducing himself in Korean. His pronunciation was so good that the Korean netizens were surprised and praised him for sounding like a native. Some even compared him to BLACKPINK Lisa when speaking in Korean.","Asa,Asa Baby Monster,Baby Monster,Baby Monster Asa,Baby Monster Youtube,fan reaction to Asa Baby Monster,YG,YG Entertainment,Asa is a new member of Baby Monster,Knets,Asas baby monster talent shocked Korean netizens,Knets are shocked at BABYMONSTER Asas Korean,member baby monster,baby monster asa,knets reaction to Baby Monster Asa,Baby monster update,baby monster news,Lisa blackpink baby monster,Yg Baby Monster,Asa Baby Monster info,baby monster"
404,BABYMONSTER,2633,162,YG NEW GIRL GROUP BABYMONSTER PREDICTION (PART 2) ✨️ #kpop #blackpink #fypシ #babymonster #ygngg,PLUTOBAE🪺,djUQW6BOECk,4 days ago,This transcript is a conversation between two people where one asks how the other is feeling and they respond that they are good. The response is met with applause.,"Ygngg,Yg new Girl group,babymonster,Babymonster,Baby Monster,Ruka,Rora,Ahyeon,Jennie,Blackpink,bTS,BTS,TXT,Ateez,baby monster,BABY MONSTER,prediction about babymonster,Chiquita,Pharita,Lisa,Yg,4th gen girl group,Baby monster song,Baby monster music,Barmon"
405,mr beast,33366743,1225601,Giant Slushy (ft. Mr Beast),Nick DiGiovanni,pfQESDiqyCc,4 months ago,"Jimmy and an unnamed person made a Beast Fruit drink to fill a giant glass. It consisted of strawberry lemonade, frozen strawberries, Kool-Aid, and ice. They blended it together and poured it into the cup, but didnt make enough for the giant glass. The drink was deemed to be pretty good but the portion size was considered average.","giant,slushy,mr. beast,Nick DiGiovanni,Cooking,Food,Chef,Recipe,Gordon Ramsay,Kitchen,ASMR,MasterChef,Osmo Salt,TikTok,Salt Bae,Uncle Roger,Jamie Oliver,Knife Throw,Knife Drop"
406,mr beast,30279706,1402779,I SAVED A HUMAN LIFE - CHALLENGE,MeatCanyon,n-tQXZCEi54,2 years ago,"A terminally ill fan of MrBeast was given a Tesla and 5,000 dollars. To honour his legacy, they will plant 2,000 trees in Liberty Missouri and 1,000 trees for every million views the video gets. The fan will receive a new heart from a donor soon and MrBeast has bought the entire hospital.","Mr Beast,MrBeast,Meatcanyon,Challenge,Meatcanyon MrBeast,Meatcanyon Mr Beast"
407,mr beast,19152659,671331,Do I Work At MrBeast Burger?,Milad Mirg,1HK_bGra0D0,8 months ago,"The speaker was asked by Mr Beast Burger to go into their kitchen and try making items off the menu. They found it interesting to compare making burgers to making sandwiches, but they are not an employee at Mr Beast Burger. However, they still enjoy the food.","#shorts,asmr,burger,food shorts,milad,milad mirg,mr beast,mrbeast,mrbeast burger,music,shorts,youtube shorts"
408,mr beast,18674604,320054,I Spent 50 Hours Buried Alive (Lego MrBeast),Brickverse,4FWao3QL5Ic,1 year ago,"Jimmy decides to spend 50 hours buried alive in a coffin, and his friends Chris and Karl follow through with the challenge. Near the end of the 50 hours, Karl interrupts Jimmys solo vigil to invite him to play Minecraft, but Jimmy declines and tells him to get back on watch. After they successfully complete the challenge and dig him out, Karl apologizes for leaving Jimmy in the dark when their walkie-talkie batteries die. In the end, despite some near misses (including a fire","lego,mrbeast,I Spent 50 Hours Buried Alive,lego mrbeast,brickverse,stop-motion,stopmotion,stop motion,animation,brickfilm,brick film,dream,karl,chris,minecraft,dream smp,karljacobs,Karl Jacobs,dreamwastaken,lego minecraft,lego dream,lego dream smp,mr beast"
409,mr beast,15727662,621617,Hole Leads To Wednesday Addams and Mr Beast 😍  #shorts #minecraft,Wuddke,vhr5hi6A_Yw,5 days ago,"This transcript is of someone speaking in front of an audience, who have applauded twice. The speaker then says huh foreign.","Minecraft,Minecraft memes,Minecraft but,Minecraft short,Always Help The Steve,always Help a Steve,minecraft but,minecraft meme,minecraft memes,minecraft shorts,shorts,youtube shorts,minecraft mods,minecraft survival,minecraft revenge,steve and alex,steve and alex minecraft,revenge on steve and alex in minecraft,help a steve in need,Minecraft revenge,Minecraft story,Minecraft steve,Minecraft steve and alex,Steve,Wait...,Always help,Wednesday Addams"
410,mr beast,13367430,471244,If MrBeast Made SQUID GAME,Avocado Animations,q8LscnDnhJc,1 year ago,"A group of people were invited to compete in a series of childrens games for a prize of $40 million, however if they lose one of the games, they die. The first challenge involves cutting out a shape from a cookie with a needle. The sponsor is an online platform for buying human organs from the black market, and Mr Beast will be flying out 10 random subscribers to compete in one of the next challenges.","avocado,avocadoanimation,avocado animations,2d animations,animation,mrbeast,mrbeast squidgame,mrbeast squid game animation,mrbeast squid game avocado animations,mr beast animation,mr beast game,Mr beast Squid game be like,Mrbeast avocado animations,Mr beast 2d animations,Mr beast parody,Squid game animation,Squid game parody,mrbeast money,mr beast squid game,$456000 Squid Game In Real Life"
411,mr beast,11224056,901310,MrBeasts Girlfriend On Being In A MrBeast Video,Wide Awake Podcast,w5GuYDeExPw,1 month ago,"100 girls and 100 boys competed in a challenge to see who could stay in a circle the longest for a chance to win $5,000 each. Unfortunately, the number of female contestants was too low, so Mr Beasts girlfriend was invited to join. The others knew she was dating him but pretended they didnt, and he avoided eye contact at all costs.","mr beast,mrbeast,mrbeast girlfriend,logan paul,karl jacobs,mr beast girlfriend,beast reacts,mr beast video,jimmy donaldson,flagrant"
412,mr beast,9830603,364896,"Caves Lead to Mr Beast Survive 100 Days In Circle, Win $500,000 BUT Wednesday Addams Helps me... 😮",Wuddke,IOS0zRHc3QA,1 day ago,Two people are discussing a game in which they need to survive a circle until the color changes.,"Minecraft,Minecraft memes,Minecraft but,Minecraft short,Always Help The Steve,always Help a Steve,minecraft but,minecraft meme,minecraft memes,minecraft shorts,shorts,youtube shorts,minecraft mods,minecraft survival,minecraft revenge,steve and alex,steve and alex minecraft,revenge on steve and alex in minecraft,help a steve in need,Minecraft revenge,Minecraft story,Minecraft steve,Minecraft steve and alex,Steve,Wait...,Wednesday Addams,Skibidi,Always"
413,mr beast,9263336,435467,MrBeast bought THIS???,Keeley,crIvByzPqbI,2 weeks ago,"In this transcript, someone was packing up merchandise orders when they found an order from Mr Beast. They decided to make it extra special by coating it in paint and glitter, then sent it off with the postman. They then received a message from someone asking where they got their merchandise as it said it was delivered but never arrived. It turns out that order was meant for Mr Beast, not the person who had sent the message.","2022,challenge,comedy,Comedy,entertainment,family friendly,funny,Funny,funny video,game,games,gaming,hilarious,humor,laugh,new,no swearing,prank,pranks,reaction,Recordings,video"
414,mr beast,8438815,272465,How I Touched Mr. Beast,Manuel Boza,d7DQE26bnXY,10 months ago,"A person created a plan to attempt to get close to Mr Beast, including breaking up with their girlfriend and using all of their savings to buy him a car. However, when they went in for a handshake, something strange happened and they were never able to talk to him again.","mrbeast,mrbeast chocolate,mrbeast squid game,how i touched mr beast,how you can meet mr beast,mrbeast gaming,mr beast reacts,mrbeast bar,manuel boza,shorts"
