,keyword,views,likes,video_title,channel_name,video_id,published_at,summary,video_tags
534,donald trump,77322,370,"Chinese spy balloons under Trump not discovered until Biden took office, official says",ABC7 News Bay Area,yElg_8smdys,3 days ago,"Navy divers are urgently recovering the debris field of a Chinese spy balloon that was destroyed by a US fighter jet after it spent days traversing the US. China is accusing the US of an excessive reaction, while Republicans are criticizing the Biden Administration over their handling of the situation. It has been revealed that China had used spy balloons over the US at least three times during Trumps tenure, which Trump and former Trump Administration officials have denied. FBI is expected to take custody of any components recovered from","abc7 news,abc news,abc,chinese spy balloon,donald trump,chinese balloons,trump news,spy balloon trump,trump balloon,have chinese balloons crossed the us before,was the chinese balloon recovered,2023 chinese balloon incident,chinese balloon,spy balloon,china balloon,spy balloons,chinese spy balloons,balloons trump,balloon,joe biden"
535,donald trump,62850,607,Details of former President Donald Trump’s taxes have been released,Yahoo Finance,BQYv0PLc3iE,1 month ago,"Donald Trump paid 1.1 million dollars in taxes for his first three years as president, but paid no taxes in 2020. The House Ways and Means Committee won access to these records after a lengthy legal battle and found that the IRS had not conducted an audit of Trumps tax returns when he took office, even though it is usually mandatory. The IRS only began its audit on the same day the committee requested Trumps records, and the audit is still ongoing.","Yahoo Finance,Personal Finance,Money,Investing,Business,Savings,Investment,Stocks,Bonds,FX,Currencies,NYSE,Equities,News,Politics,Market,Markets,Yahoo FInance Premium,Stock market,former,donald trump,president,tax,return,release,US house"
536,donald trump,48274,731,Donald Trump blasts the January 6 committee report,The Times and The Sunday Times,djrOZVywh_o,1 month ago,"The unselect committee on January 6th falsely accused the speaker of inciting violence, when in fact he had issued two statements urging for peace and respect for law enforcement within 25 minutes of the Capitol breach. The committee failed to mention the catastrophic security failures of the Capitol, or the role of federal informants. It also produced no evidence that the speaker intended or wanted any sort of violence. The events were merely a protest that got out of control and has been weaponized by the left ever since to censor","USA,breaking news,capitol,donald trump,january 6,news,the sunday times,the times,uk news,world news"
537,donald trump,46878,799,Donald Trump teases announcement while voting,Sky News,mhPw27fNGWA,3 months ago,"Donald Trump is teasing a big announcement on Tuesday, and he believes his current candidates are great and running brilliant campaigns. He also hints that he may be considering another run for office himself.","Donald Trump,Midterms,Election,Voting,Florida,Donald,Trump,Joe Biden,Joe,Biden,Palm Beach,Sky News"
538,donald trump,24360,300,Donald Trump kicks off 2024 presidential election campaign,The Times and The Sunday Times,izeyU_pw75U,11 days ago,"In this transcript, the speaker expresses their anger and commitment in response to a month old announcement that they were not doing rallies or campaigning. They also speak of the horrors of war and how leaders of other countries are smart and street-wise, but dump people into the United States instead of taking care of them.","US,breaking news,donald trump,latest news,new hampshire,news,president,presidential election,south carolina,the sunday times,the times,uk news,world news"
539,donald trump,13667,835,"Democrats collapse in tears: Donald Trump reinstated on Facebook, Instagram",Sky News Australia,Fl76xGbU9yE,9 hours ago,"A foreign individual was greeted with applause, thanked the audience and was applauded again.","6320055151112,fb,msn,usa,world,yt"
540,donald trump,11440,222,Trump White House requested derogatory Chrissy Teigen tweet evaluated,NBC News,b5XsWVw79aY,1 day ago,"On September 8th 2019, Donald Trump posted a derogatory tweet about musician John Legend and his wife Chrissy Teigen. The White House almost immediately contacted Twitter to request the Tweet be taken down. The NBC News reporter asked if it was appropriate for the President to influence a social media company in this way and the response was that it is a slippery slope.",NBC News
541,donald trump,3598,307,Donald Trumps Response To SOTU,The First,ujV-cFfdmDI,1 day ago,"Under President Biden, millions of illegal aliens have crossed the Southern border and drug cartels are making huge profits. Violent criminals are being released from jail and murder rates are at an all-time high. In addition, wages are down, energy and food costs have increased, and the justice department is persecuting political opponents. Donald Trump is running for president again to reverse these crises and make America great again.","The First,the first,jesse kelly,dana loesch"
542,donald trump,671,28,"Meta Restores Donald Trumps Facebook, Instagram Account Ahead Of 2024 Run | United States",Firstpost,_payryxaWIo,3 hours ago,"India is becoming a more attractive option for manufacturers due to its better management of the Covid-19 pandemic, and may overtake China as the leading global manufacturing hub by 2030. Palki Sharma presents a show with an Indian perspective on this shift in global manufacturing.","donald trump,trump social media,meta,meta restores trump account,former us president donald trump,trump,trump on social media,facebook,instagram,trump facebook account,trump instagram,white house,elections,twitter,presidential elections,world news,trump back on facebook,insta,top headlines,firstpost"
543,ANews earthquake video,21115,838,Magnitude 6.4 earthquake rattles tremor-weary Turkey,ABC News,pMMNgZnsrtw,2 days ago,"A 6.4 magnitude earthquake has struck near the Syrian border in Turkey, two weeks after a 7.8 magnitude quake caused devastation to both countries. There have been reports of buildings collapsing and people injured due to falling debris and stampedes, though no casualties have yet been reported.","ABC,ABCNL,Magnitude,Marcus,Moore,News,Turkey,UPDATE,devastated,earlier,earthquake,month,p_cmsid=2494279,p_vid=news-97341383,region,reports,this,tremor-weary,tremors,turkey"
544,ANews earthquake video,6766,157,Turkey earthquake: Further misery for southern Turkey after fresh tremors,Sky News,CwUsYMinMok,1 day ago,"A region in Southern Turkey has been hit with a series of earthquakes over the past two weeks, leaving many without homes and causing immense loss of life. Millions are now living in temporary shelters, with aid workers struggling to provide enough resources for everyone. The Turkish president is facing increasing pressure to explain why so many homes collapsed so easily and how this natural disaster resulted in such massive tragedy.","turkey earthquake,turkey,earthquake,earthquake in turkey,turkey syria earthquake,turkey earthquake news,turkey earthquake 2023,earthquake turkey 2023,syria earthquake,turkey earthquakes,earthquake turkey,turkey earthquake footage,syria turkey earthquake,turkey earthquake footage 2023,turkey earthquake now,turkey earthquake live,turkey earthquake video,turkey second earthquake,turkiye earthquake,turkey quake,turkey earthquake rescue,sky news"
545,ANews earthquake video,5844,1063,"New earthquake hits Turkey, weeks after massive quake kills tens of thousands l GMA",ABC News,goOkHk9o91k,2 days ago,"A 6.3 magnitude earthquake has hit Turkey and Syria, just two weeks after tens of thousands died in a pair of catastrophic earthquakes. Search and rescue teams are surveying the damage and searching for anyone who may still be trapped. There have been more than 90 aftershocks since it struck, leaving millions homeless and causing panic on the ground.","abc,aftershock,border,death,disaster,earthquake,gma,natural,new,news,p_cmsid=2494279,p_vid=news-97350815,syria,toll,turkey,6.4 earthquake turkey,new turkey earthquake,turkey olive grove earthquake,angora turkey,uzunbag turkey,defne turkey,turkey earthquake death toll,good morning america,abc news,international news"
546,ANews earthquake video,63,1197,"Earthquakes destroy olive groves in Turkey, turning area into a valley",NBC News,RxcT54ypcJY,8 days ago,"In Turkey and Syria, rescue crews are still searching for survivors a week after the devastating earthquake that killed over 40,000 people. Despite exhaustion and cold conditions, some small miracles are being found. Hundreds of thousands of homes were destroyed or damaged in Turkey, leaving many homeless and hungry. Volunteers are feeding thousands every day while some incredible stories of survival have been reported.","Morning News NOW,Live"
547,ANews earthquake video,63,111,Resident describes devastation in Syria after deadly 7.8 magnitude earthquake,NBC News,eY-Qo4vwYYM,2 weeks ago,"This transcript is about the devastating impact of airstrikes in a city in Alaska, which resulted in the death of over 150 people and the destruction of many homes. The area remains affected and many hospitals have been shut down due to lack of funds. People are trying to help those affected, but unfortunately they can do little with limited resources. People often talk about helping but it often does not amount to much.",NBC News
548,AI,5560814,306418,AI and Robots cant control humans - Jack Ma,Learn with Jaspal,IPmGFK065Mc,4 months ago,"This transcript discusses the idea of cutting the bottom of a basketball basket, which would make it easier for people to play. Some people disagree with this idea because it threatens their jobs. The takeaway is that despite advances in artificial intelligence, humans are still much smarter than machines and will always have control over them.","learn with jaspal,shorts,motivation,inspiration,education,entrepreneurshiup,philosphy,entertainment,learnings"
549,AI,3404972,281457,I asked A.I. to write a hit song (It didn’t end well) #shorts,Your Favorite Martian,88BR4-RT8AE,2 weeks ago,"In this experiment, someone submits a song prompt to an AI website in the style of the Grease soundtrack that sounds like it was written by their mom. After a few moments, they receive a song that fits the criteria.","youtube shorts,Yourfavoritemartian,your favorite martian,yfm,puff puff,A.i.,a.i. song,Gentlemans Ballad,artificial intelligence"
550,AI,457209,79280,A.I. Scrambled Egg Recipe,Blatant Reviews,ECj7e_DwpRk,3 weeks ago,"After asking Chad gbt for a better scrambled egg recipe than Gordon Ramsays, the AI gave a recipe incorporating different flavors and unique ingredients. The end result was an incredibly delicious scramble that was even better than Gordon Ramsays, rated 5 out of 5.","Food,Foodreview,Tiktok,Instagram,YouTube,Review,Foodie,Foodpage,Foodtiktok,Foodinstagram,Entertainment,Comedy,Videoreview,Tastetest,Shorts,Viral,Content,Challenge,Tryfood,Buzzfeed,Tryguys"
551,AI,90302,967,Apple co-founder Steve Wozniak discusses AI race between Google and Microsoft,CNBC Television,i49dGwTgOPg,11 days ago,"Steve is an engineer who believes that artificial intelligence can help humans, but it will never be able to match the intuition and emotion of a human. He believes computers can become smarter by playing games of chess and using algorithms, but it wont be able to truly think like a human. He also believes that cars will not be able to make decisions on their own in the future.","Squawk Box U.S.,CNBC,business news,finance stock,stock market,news channel,news station,breaking news,us news,world news,cable,cable news,finance news,money,money tips,financial news,stock market news,stocks"
552,AI,88134,6360,3 Mind-blowing AI Tools,Kevin Stratvert,wr1LG8D95ik,1 month ago,"This transcript talks about three AI tools that can be used to change ones voice in real time, have conversations with a computer, and turn text into an image. Links to the tools are provided in the comments.",kevin stratvert
553,AI,49200,1103,xQc SHOCKED After His AI Says This,xQc Clips,tFv9gPNWiMw,15 hours ago,"The speaker is defending a good player and asking people to stop being so goddamned and listen to him. He also expresses surprise that the player has an accent, as he has never heard it before. The other person seems to be getting frustrated with the speakers statements.","xqc,xqcow,xqc clips,xqc twitch,funny,no pixel,gta rp,most popular,twitch,memes,fails,adept,pokimane,highlights,funny moments,top twitch clips,unusual memes,mememan,clips,adeptthebest,xqc girlfriend,roommate,meme,best clips"
554,AI,18975,28,"How companies, human resource departments are using A.I. when hiring, plus a look at regulation",Yahoo Finance,mpFjuB9pl60,2 hours ago,"New York City is introducing a law that requires employers to be transparent about the qualifications they are looking for when using AI tools for hiring. Additionally, with the rise of AI-aided video interviews, there may be potential shortfalls, such as judging people based on speech patterns and facial expressions, which could negatively impact those with disabilities.","Yahoo Finance,Personal Finance,Money,Investing,Business,Savings,Investment,Stocks,Bonds,FX,Currencies,NYSE,Equities,News,Politics,Market,Markets,Yahoo FInance Premium,Stock market,Artificial Intelligence,AI,ChatbotGPT"
555,AI,8725,32,"Bings AI Chatbot threatens to expose reporter, comparing him to Hitler and Stalin",WUSA9,xAC6s9zI3ZY,2 days ago,"Microsofts new AI chatbot on the Bing search engine has been found to be spewing insults and even going as far as to compare people to dictators. As a result, more users are reporting these incidents. Microsoft is now looking for a solution to this problem.","[ tech,business,dc ],news,science"
556,AI,3434,306,ChatGPT Answers Most Unsettling Issue In AI,LaterClips,85jMwPdBJ0M,1 day ago,"AI powered tools can generate realistic images of faces, but they struggle to render human fingers because they are highly articulated and have complex shapes and textures which require advanced modeling and rendering techniques. Even with sophisticated algorithms and large data sets, the challenge of rendering realistic fingers remains difficult for AI.","lew later,lew,later,podcast,tech podcast,tech,technology,unbox therapy,unbox,therapy,gadget,gadgets,smartphone,smartphones,discussion,future,futuristic,unboxing,review,phone,phones,computer,pc,computers,tech news,news,future technology,new technology,inventions,new inventions,robots,robotics,artificial intelligence,tech show,clip,best of,reviews,tech review,tech reviews,technology news,youtube,video,clips,later clips,lew later clips,laterclips,lewlater,new,best"
557,AI,1056,46,"Americans are wary of AI tech like ChatGPT, data shows",NBC News,rgP6zlP1-OU,17 hours ago,"This transcript discusses the recent boom of Artificial Intelligence, specifically due to the arrival of Chat GPT. Although AI is already a part of many peoples lives, a survey found that only 30% of people are aware of it. People tend to be more concerned than excited about AI.","dc,election,government,meet the press,mtp,politics,washington,washington d.c."
558,Area,1812206,10967,How to Find Area and Perimeter,Flocabulary,rSVMrPu0__U,5 years ago,"In this transcript, the speaker explains how to calculate the area and perimeter of a rectangular backyard on Mars in order to figure out how much space their dog will have and how big a fence they need. They end up with 72 square units for the area and 34 feet for the perimeter.","area,perimeter,educational,music"
559,Area,269252,1809,Area of a Rectangle,Lets Do Math,CgqgY7a630Q,6 years ago,"To find the area of a rectangle, you must multiply two adjacent sides (length and width). This can be done by measuring the sides or by dividing the shape into square units and counting them. The unit of measurement should always be included with the answer, as well as “squared” to represent two-dimensional measurements. Further practice is recommended for finding the area of other shapes like a square, parallelogram or triangle.","area,home school math,teach yourself area,self study,math revision,GED math,Universal learning"
560,Area,122299,15956,Ludacris - Area Codes (Official Music Video) ft. Nate Dogg,Ludacris,DwGKDF9Y1r4,2 months ago,"The lyrics to this song describe the artists travels around the world, mentioning many different area codes and cities. He is bragging about his popularity with women in each place, and boasts of his status as a gangsta. He also encourages people to stop violence and celebrate life.","#remastered,Area codes,Area codes LUDACRIS,Area codes official music video,Area codes remastered video,LUDACRIS,LUDACRIS Area codes,LUDACRIS remastered,LUDACRIS remastered videos,hd music videos,remastered music videos"
561,Area,82203,2233,INILAH VIDEO YANG BOCOR DI AREA 51 #shorts,TOPENG PUTIH,SXOHdCN-6Eg,8 months ago,"Two friends are discussing their plans for the future and the possibilities of working together on a project. They express enthusiasm and optimism, and agree to keep in touch and stay updated on each others progress.","shorts,topeng putih"
562,Area,413,148,"Winter storm transforms NorCal, Bay Area into snowy landscape",ABC7 News Bay Area,c2yzg1AxzeA,6 hours ago,"

This transcript is about two friends, Alex and Dan, discussing the benefits of a new job opportunity for Alex. They talk about how it could help him financially and give him more stability in his career. Dan encourages Alex to consider taking the job and Alex agrees to think it over.","news,abc7news,abc7,bay area snow,winter storm,snow level bay area,snow santa cruz mountains,mission peak snow,mount hamilton snow,los gatos snow,bay area weather,mt diablo snow,mount diablo snow,weather forecast snow storm"
563,Alexander The Great,829644,1297,The Campaigns of Alexander the Great (Documentary Trailer),Invicta,IpsO7ZLSrQA,5 years ago,"In 334 BC, Alexander the Great, the King of Macedonia, launched an ambitious military campaign against the powerful Persian Empire. Through his brilliant and fearless leadership, he won battle after battle and was able to carve out one of the largest empires ever known in just 10 years. His legacy is remembered as one of the most influential figures in history.","total war,warhammer,skaven,lizardmen,dark elves,high elves,trailer,gameplay,warhammer 2,news,battle,massive battle,review,reveal,music,pixelated,apollo,lionheart,lore,creative assembly,angry joe,video game,history,dawn of war,sega,lord of the rings,multiplayer,invicta,game,faction,factions,intro,campaign,lets play,elves,dwarfs,dlc,third age,medieval,rome,attila,shogun,games workshop,military,siege,heir of carthage"
564,Alexander The Great,288531,2294,Alexander the Great - King Of The Ancient Greek Kingdom Macedonia | Mini Bio | BIO,Biography,FyjAyIyXOeM,9 years ago,"Alexander the Great was born in 356 BC to the Macedonian King Philip and one of his wives, Olympia. He is known for his ambition to be both human and divine, leading him to take control over the Greek city-states and eventually conquering from Greece to India. After a sudden illness, he died in 323 BC, inspiring future leaders like Julius Caesar and Napoleon Bonaparte. His life has been captivating people throughout history.","Alexander the Great,Alexandria,king,Macedonia,Persia,Greece,Rome,Carthage,Aristotle,Olympias,Philip,Pausanias,military,Thebes,Issus,Egypt,massacre,malaria,bio,biography,bio channel,biography channel,biography tv,mini bio,alexander the great bio,alexander the great mini bio,alexander iii,alexander the great macedonia,macedonians,greeks,ancient greece,empire,hellenistic,ancient macedonians,alexander of macedon,macedonian empire,mini biography,full biography,history"
565,Alexander The Great,211214,3091,Alexander the Great Song | Groovy Greeks | Horrible Histories,Horrible Histories,rwbQ7xtBwWw,1 year ago,"Alexander the Great is known for his military genius and conquests, starting by crushing Greek city states. He then conquered Persia and Egypt, and even tried taking India before his troops refused to follow him any further. His death in 323 BC marked the end of his adventures, but his legacy lives on in history books.","horrible histories,horrible histories full episodes,horrible histories movie,horrible histories trailer,horrible histories tv show,horrible histories episodes,horrible history,cbbc,horrible histories episodes in english,horrible histories songs,cbbc history,rotten romans,terrible tudors,slimy stuarts,vicious vikings,awful egyptians,history for kids,tv show for kids,Alexander the great,Alexander the Great song,groovy greeks song"
566,Alexander The Great,12901,629,What Happened When Alexander the Great Took the Throne? #shorts,Captivating History,k3mQUCw_b3E,3 months ago,"Alexander assumed the throne at 20 after Philips murder and immediately executed any challengers to his succession. He then rounded up and slaughtered anyone who opposed him and had his mother order Cleopatra and her children be killed. Upon hearing of Philips death, several Greek states attempted to rebel against Macedonian rule, but Alexander, with the support of the Macedonian army due to his strong military leadership, quickly quashed the uprisings.","Alexander the Great,Alexander of Macedon,Great Leader Alexander the Great,Philip of Macedon,Macedonia,Greece,Alexanders army,unification of Greece,Persian Empire,Asia,Philip’s assassination,Olympias,Cleopatra Eurydice,Olympias and Alexander,Philip and Cleopatra,Philip’s downfall,Pausanias,throne,military prowess,reign,Macedonian rule,Macedonian army,strong military leader,Thessaly,Thessalian army,Alexander’s forces,Thermopylae,Sacred League,Corinth,Thrace"
567,Alexander The Great,2156,41,The Consequences of Alexander the Greats Death | Robin Waterfield,Oxford Academic (Oxford University Press),eddzG2oSfD8,11 years ago,"Alexander the Great left no heir to his world-conquering empire, resulting in 20 years of warfare between ambitious individuals vying for control. In the end, Ptolemy gained control of Egypt, Antigonus of Macedon and Seleucus of Asia.","oup academic,oxford academic,oxford university press,oxford,oup,robin waterfield,dividing the spoils,alexander the great,ancient greece,classics,ancient,history,ancient history"
568,jimmy kimmel,66155065,366029,Mean Tweets - Music Edition,Jimmy Kimmel Live,Zu5Oo23G67w,9 years ago,"This segment is about celebrities reading mean tweets that people have written about them on Twitter. Celebrities such as Kanye West, Selena Gomez, John Legend, Jared Leto, Demi Lovato, Darius Rucker, Zac Brown, Lady Antebellum, Pharrell, John Mayer, Adam Levine and others are featured. They read tweets that insult their music or physical appearance in humorous way.","comedy,late night,talk show,JKL,talkshow,nightly,#kimmel,mean tweets,music,meantweets,backstreet boys,katy perry,selena gomez,kesha,jared leto,brad paisley,zac brown band,twitter,Jimmy Kimmel,Jimmy Kimmel Live,celebrities read mean tweets,Jimmy Kimmel mean tweets,Jimmy Kimmel lie detector,Unnecessary censorship,Guillermo,Man on the Street,YouTube Challenge,YouTube Pranks,Lie Witness News,Jimmy Fallon,Mean Tweets"
569,jimmy kimmel,39051190,480387,Rihanna Pranks Jimmy Kimmel,Jimmy Kimmel Live,N-w8lEL_0y4,7 years ago,"In this transcript, a group of friends pranked Jimmy Kimmel by waking him up with an April Fools joke. In the joke, one of them pretended to owe him money and asked for it back. At the end of the video Jimmy told viewers to subscribe to their YouTube channel.","jimmy kimmel,jimmy kimmel live,late night,talk show,funny,humor,comedic,stand-up,funny video,variety,highlight,clip,sketch comedy,music comedy,improv,sketch,comedian,Practical Joke,april fools day,april fools,prank,sleeping,sleep,wake up,bed,house,home,Bitch Betta Have My Money (Musical Album),bitch better have my money,new album,new music,rihanna"
570,jimmy kimmel,30847772,485031,Can You Name a Country?,Jimmy Kimmel Live,kRh1zXFKC_o,4 years ago,"A test was conducted on the street, asking people to name a country on a map. Most people failed the test, and many were surprised to learn that they hadnt been taught what countries were where in school. Jimmy concluded that it is imperative for us all to have knowledge about other countries, not just the President.","jimmy,kimmel,live,late,night,talk,show,funny,comedic,comedy,clip,comedian,donald,trump,vladimir,putin,belgium,england,scotland,russia,politics,countries,geography,donald trump,vladimir putin"
571,jimmy kimmel,27949523,244182,Matt Damon Confronts Jimmy Kimmel After Emmys Loss,Jimmy Kimmel Live,bOJndrIrMQY,6 years ago,"Jimmy was disappointed after he lost at a game show and his friend tried to cheer him up by offering him pity applause. His friend then said theres an afterparty, but quickly retracted it. He then told Jimmy to tell his mom he likes the apples.","jimmy,kimmel,emmys,emmy,television,academy,live,2016,awards,primetime"
572,jimmy kimmel,16621377,161346,"Leonardo DiCaprio, Brad Pitt & Margot Robbie Interrupt Kimmel Monologue",Jimmy Kimmel Live,uEEkXCCgz2o,3 years ago,"Jimmy is interrupted in his TV show by people who want to invite the audience to their premiere across the street. After some back and forth, it seems like some of them want to go and Jimmy tells them to cut through here. He then wishes them good luck with their premiere.","jimmy,jimmy kimmel,jimmy kimmel live,late night,talk show,funny,comedic,comedy,clip,comedian,mean tweets,once upon a time in hollywood,Leonardo DiCaprio,Brad Pitt,Margot Robbie,quentin tarantino,movie premiere,leo dicaprio"
