,keyword,views,likes,video_title,channel_name,video_id,published_at,summary,video_tags
189,piers morgan,100998,248,Killer Women with Piers Morgan | ITV Hub,ITV,-tYremEwGAg,5 years ago,"In this transcript, a woman talks about her experience with a dangerous 15-year-old, as well as her own experience of finding her husband dead. Piers Morgans show will be airing an episode on the 22nd of June which features women who have killed.","tv,television,ITV,Britain,British,UK,United Kingdom,watch,live,ITV Player,programme,show,itv.com,ITV (TV Network),Killer Women,Piers Morgan,prison,documentary,life inside,the thug life,murder,jail,death penalty,lethal injection,escape,drugs,vice"
190,piers morgan,91110,1322,Piers Morgan SLAMS Madonna For Threatening To Blow Up the White House | Good Morning Britain,Good Morning Britain,WE15PXgqlG8,6 years ago,This transcript is about a couple discussing Madonnas speech at the womens march and how she has been able to get away with saying offensive things. The conversation centers around one person accusing the other of wanting to blow up the White House and kill the president of the United States.,"good morning britain,breakfast show,news,morning news,gmb,good morning britain interview,morning breakfast show,itv morning,morning show,piers morgan,susanna reid,madonna,white house,donald trump,womens march"
191,piers morgan,63986,595,Have you offered your resignation? Gavin Williamson evades Piers Morgans questions,Guardian News,j_Co1BYC1PM,2 years ago,"In this transcript, Piers Morgan is asking Education Secretary Gavin Williamson if he has offered his resignation to the Prime Minister due to his perceived failures during the coronavirus pandemic. Williamson responds that his focus is on making sure children get the best remote education, ignoring Morgans question.","Gavin Williamson,politics,gdnpfpnewspolitics,world,gdnpfpnewsworld,Gavin Williamson resignation,piers morgan,piers morgan interview,Good morning Britain,coronavirus,schools,schools england,schools reopen,virus,pandemic,education,covid,covid 19,have you offered your resignation,resign,resignation,corona,gmb,piers morgan vs gavin williamson,cringe,susanna reid,morgan,schools closed,school closures,2021,uk,gdnpfpnewsuk,lockdown,quit,boris johnson,piers morgan gmb,tool"
192,piers morgan,43327,266,Piers theres a problem... Piers Morgan tells Chris Evans about his Donald Trump interview,Virgin Radio UK,2bXyeFa5q40,9 months ago,"In this transcript, the speaker was called up to President Trumps office after he had made negative remarks about him in the past. The speaker expected to be reprimanded but managed to turn the situation around by talking about Trumps recent hole-in-one golf shot. This led to an unexpected 75 minute interview with wide-ranging topics, and the speaker was able to come away from it with an amazing outcome despite his initial worries.","virgin radio,virgin radio uk,virginradiouk,chris evans,chris evans virgin radio,chris evans breakfast show,graham norton,the graham norton show,graham norton virgin radio,piers morgan,donald trump,piers morgan donald trump,piers morgan chris evans,talk tv,talk radio,piers morgan talk tv,piers morgan uncensored"
193,piers morgan,30046,759,EXCLUSIVE: Prince Harrys Ex-Lover Wishes She Was Warned About Book,Piers Morgan Uncensored,JwCJETZSK00,1 day ago,"People were asking the speakers family and friends who they were, and the speaker wished they had been given a heads up that it would be revealed in a book. The consequences of this knowledge being out there will not go away anytime soon.","prince harry,piers morgan,prince harry interview,shorts,royal family,meghan markle,sasha walpole,sasha walpole interview,sasha walpole piers morgan,prince harry virginity,prince harry virginity story,prince harry spare,prince harry spare book,prince harry spare virginity story,woman who took harrys virginity,woman prince harry,prince harry news,piers morgan interviews woman prince harry,piers morgan prince harry,piers morgan meghan markle,tiktok,interview,tv"
194,piers morgan,30014,175,Who Is the Most Outrageous Man in TV Between Piers Morgan and Keith Lemon? | Good Morning Britain,Good Morning Britain,Ex-ZneasBUs,3 years ago,Keith Lemon is known for being the most outrageous man on television. He finds celebrities entertaining and he thinks Katie Price was the worst guest on Celebrity Juice because she was so quiet. He recently went shopping with Holly Willoughby and Mel B for the Christmas special and they were reviewing TVs.,"good morning britain,breakfast show,news,morning news,gmb,good morning britain interview,itv,piers morgan,susanna reid,Talk Shows - Topic,keith lemon,holly willoughby,celebrity juice,celeb juice,keith lemon good morning britain,keith lemon gmb"
195,piers morgan,27432,491,Peter Crouch reacts to Ronaldo interview with Piers Morgan ⚽️,JOE,HZ4O-Pr9EeU,2 months ago,"In this transcript, the speaker discusses their opinion on a bad decision being made by Manchester United, and how interesting it is as a fan to hear a player speak so openly about it. They also suggest that a less confrontational approach would be beneficial for all parties involved.","Ronaldo interview,Ronaldo interview with piers Morgan,Ronaldo piers Morgan,Peter crouch reacts,Peter crouch Ronaldo,Peter crouch Ronaldo interview,That Peter crouch podcast,Peter crouch podcast,Crouchfest,Peter crouch,Cristiano Ronaldo,Talk tv,Piers Morgan,Piers Morgan uncensored"
196,piers morgan,18874,166,Piers Morgans Papoose-Gate Scandal | Good Morning Britain,Good Morning Britain,wRcos6rP2bk,4 years ago,"In this transcript, two people are discussing how men often think that carrying babies is a womans job and should be done by women only. They suggest a campaign and fundraising to raise awareness of the issue, and jokingly suggest that those who disagree should wear a lime-green mankini.","good morning britain,breakfast show,news,morning news,gmb,good morning britain interview,itv,piers morgan,susanna reid,Talk Shows - Topic,piers morgan papoose,piers morgan rant,ross kemp,harry hill,harry hill pies piers morgan,papoose,papoose debate,richard arnold,daniel craig,chris evans,captain america,emasculating men,judge rinder,louise redknapp"
197,piers morgan,10690,64,EXCLUSIVE: Piers Morgan on Kim Kardashian Feud: Shes a Little Desperate,Entertainment Tonight,7edRgtglzbg,6 years ago,"Kim Kardashian posted a nude selfie on Twitter and Piers Morgan criticized her for it, leading to Kims supporters such as Ariel Winter and Emily Ratajkowski defending her. Kim then posted another nude photo with the hashtag liberated, sparking an argument between her and Piers about womens sexuality and decision-making.","2016,et,kim kardashian instagram,piers morgan,ETtrending,entertainment news,etnow,kim kardashian nude,kim kardashian,etonline,news,ET Online,entertainment tonight"
198,Friends,7134059,9825861,Marshmello & Anne-Marie - FRIENDS (Lyric Video) *OFFICIAL FRIENDZONE ANTHEM*,Marshmello,CY8E6N5Nzec,5 years ago,"Marshmello and Anne-Maries FRIENDS is an anthem for those in the friendzone, singing about how despite their feelings, they are nothing more than friends. The chorus spells out FRIENDS and emphasizes that no matter what, they will remain just friends.","friends,friends lyrics,friends lyric video,marshmello,marshmallow,anne-marie,anne,marie,friendzone,marshmello friends lyrics,anne marie friends,marshmello friends,Marshmello Anne-Marie - FRIENDS (Lyric Video),friends remix,pop,pop music,havana,anne marie,silence,anthem,you say you love me i say you crazy,marshmello happier,friend zone,tik tok,friends song,friends audio edit,friends tik tok,friends tik tok song,friends tiktok sound,were just friends"
199,Friends,2913761,43567,Friends: Monica Cheats on Rachel (Season 2 Clip) | TBS,TBS,QCdqHswGS5A,2 years ago,"Rachel and Monica are having a conversation about Rachels brothers girlfriend, Judy/Julie/Jody. Rachel found out that Monica had lunch with her, and when Rachel asked how it cost $53, Monica revealed that someone had stolen her credit card. She admits to going shopping with Julie, but insists that nothing happened between them. Rachel is angry and hurt, so she leaves saying she needs not to be around Monica right now.","TBS,TBS Network,Comedy,TBS Shows,Shows,TBS Funny,TBS New,New TBS,Friends,Friends TBS,Jennifer Aniston,Rachel Green,Courteney Cox,Monica Geller,Lisa Kudrow,Phoebe Buffay,Matthew Perry,Chandler Bing,Matt LeBlanc,Joey Tribbiani,David Schwimmer,Ross Geller,Monica Cheats on Rachel,Monica Cheats,Friends Season 2 Clip,Friends Season 2"
200,Friends,2693705,33598,Friends: Monica and Rachels Prom Video (Season 2 Clip) | TBS,TBS,OjsQ78t_0_M,2 years ago,"Ross and Rachel are at a prom, but Ross doesnt have a date. Jack encourages Ross to take Rachel to the prom and they end up going together. Judy cant turn off the video and Ross and Rachel leave for the prom together.","TBS,TBS Network,Comedy,TBS Shows,Shows,TBS Funny,TBS New,New TBS,Friends,Friends TBS,Jennifer Aniston,Rachel Green,Courteney Cox,Monica Geller,Lisa Kudrow,Phoebe Buffay,Matthew Perry,Chandler Bing,Matt LeBlanc,Joey Tribbiani,David Schwimmer,Ross Geller,Chandler,Chandler Wears Panties,bathroom stall,Ross,Joey,Geller,Monica,David,Matthew,Phoebe,Lisa,Matt,Rachel,Jennifer,Panties,Wears Panties,Season 2 Clip"
201,Friends,2176,31487,Friends: Monicas Parents Find Out About Her & Dr. Burke (Season 2 Clip) | TBS,TBS,laMEzEVQlq0,2 years ago,"Richard and Monica, Judys son and daughter respectively, are in a relationship. Judy is surprised by this but eventually comes round to the idea. Richards father, Jack, is also surprised by the news and expresses his surprise on his birthday. Everyone celebrates Jacks birthday with song at the end of the transcript.","TBS,TBS Network,Comedy,TBS Shows,Shows,TBS Funny,TBS New,New TBS,Friends,Friends TBS,Jennifer Aniston,Rachel Green,Courteney Cox,Monica Geller,Lisa Kudrow,Phoebe Buffay,Matthew Perry,Chandler Bing,Matt LeBlanc,Joey Tribbiani,David Schwimmer,Ross Geller,Monica dating Dr. Burke,tv series friends,Friends Season 2"
202,Friends,2174,27409,Friends: Rachel Punches a Girl in the Face (Season 4 Clip) | TBS,TBS,dzhmA92F77s,2 years ago,"This transcript is about a person named Pheebs who overslept and was running late for work. While trying to get to the set, they recall the night before when they had tried to meet someone called Joshua but instead punched a girl due to an unfortunate misunderstanding. Meanwhile, their friend Ross is in Vermont with somebody named Emily.","TBS,TBS Network,Comedy,TBS Shows,Shows,TBS Funny,TBS New,New TBS,Friends,Friends TBS,Jennifer Aniston,Rachel Green,Courteney Cox,Monica Geller,Lisa Kudrow,Phoebe Buffay,Matthew Perry,Chandler Bing,Matt LeBlanc,Joey Tribbiani,David Schwimmer,Ross Geller,Friends season 4,Jennifer,Aniston,Rachel,Green,Cox,Monica,Geller,Lisa,Kudrow,Phoebe,Buffay,Chandler,Bing,Matthew,Perry,Season 4 Clip,Season 4,Rachel Punches,Joshua"
203,usa economy,547959,11368,How Indias Economy Will Overtake The U.S. By 2050,NowThis World,eYbiQV2nueA,2017-02-21T13:00:06Z,"Indias economy has grown rapidly in recent years due to its large population, foreign investment and outsourcing, the adoption of technology from richer countries, and free-market reforms. Despite this, the average income in India is still much lower than the US and a large portion of its population is still living in poverty.","News,current events,india,Indian economy,economics,seeker daily,news,seeker,indian economy,economy,how strong is indian economy,india’s economy,economic,is india better than the us,why donald trump is wrong,is donald trump wrong about india,how fast is india growing,how strong is india,how big is india,how strong is india’s economy"
204,usa economy,528584,7794,Trump talks to governors about reopening US economy,Fox News,roE2O0IuAWo,2020-04-16T20:26:11Z,"President Trump is holding a video call with governors from across the country to discuss guidelines for reopening the US. The guidelines will be tailored to each state and county, and it will be up to the governors to determine when to reopen. The president has paid tribute to those on the front line of the crisis, such as doctors, nurses, first responders, truckers and businesses that have stepped up during the pandemic.","Trump,President Trump,Trump governors,reopening economy,trump governors,trump reopen economy,trace gallagher,trump plans on opening economy,governor dewine,governors economy,governors open states,reopen economy,state economy,social distancing,president trump,task force,coronavirus usa,trump economy,coronavirus,coronavirus pandemic,coronavirus task force,covid-19,fnc,fox news,fox news channel,fox news media,fox news network"
205,usa economy,346774,813,Price Ceilings: The US Economy Flounders in the 1970s,Marginal Revolution University,sq1zIj8s8R0,2015-02-26T03:01:56Z,"In August 1971, President Richard Nixon declared that price increases were illegal in an attempt to control inflation. This caused shortages due to the inability of buyers to signal their increased demand and suppliers having no incentive to increase quantity supplied. As a result, this caused people waiting in long lines for gasoline and other commodities and factories and offices had to close due to shortages. There were also ironic cases such as steel drilling equipment being unavailable during an energy crisis. Price controls led to unintended consequences such as baby chickens being","supply,demand,economics,ceiling,floor,price,learn economics"
206,Im pregnant,2420411,13703,"So, You Think Youre Pregnant",AMAZE Org,qs4do1DwMrI,4 years ago,"A person may have signs of pregnancy such as nausea, tiredness and sore breasts. If they suspect they are pregnant, they can take a home pregnancy test to find out. If the result is positive, they need to visit a health care provider or family planning clinic to discuss their options which include parenting, adoption and abortion.","#moreinfolessweird,amazeorg,sex education,sex ed,puberty,growing up,middle school,health,education,pregnancy,pregnant,indiana sex ed,sex ed currirculum,indiana,abortion,menstruation,period,ovulation,contraception,condoms,babies,the pill,the patch,the ring,the shot,iud,nexplanon,protection,larc,pregnancy test,fetal,prenatal"
207,Im pregnant,1108449,4962,Eating well in your first trimester,My Doctor - Kaiser Permanente,yspF1fJhXFE,8 years ago,"During the first trimester of pregnancy, it is important to stay active and eat healthy, including taking a prenatal vitamin with at least 400 mcg of folic acid. Certain foods should be avoided such as unpasteurized cheese and undercooked meat. Weight gain should be monitored and the target amount depends on pre-pregnancy weight. Exercising for 30 minutes most days can help maintain a healthy weight, aid in labor pain and benefit recovery after birth.","Pregnancy (Disease Or Medical Condition),first trimester pregnancy,Health (Industry)"
208,Im pregnant,542682,1159,"Is it safe to have sex while pregnant? with Alexandra Band, DO and Melissa Jordan, MD",Ochsner Health,5h_uC96VQuY,2 years ago,"Having sex during pregnancy is generally safe, however some spotting after intercourse can occur due to the increased vascularity and fragility of the cervix. If any spotting occurs it is best to consult a doctor for further checks.","Ochsner Health System,Ochsner,Renshco,Oshner,Medical,Medicine,Hospital,Health,Healthcare,Health and Wellness,Innovating Healthcare,Healthcare Innovation"
209,Im pregnant,282160,719,How to calculate that how many months pregnant you are? - Dr. Premlata Subhash,Doctors Circle Worlds Largest Health Platform,Wlg-mwcZ8vY,6 years ago,"In this transcript, Dr. Prem Latha explains that pregnancy is traditionally calculated from the first day of a womans last menstrual cycle, which typically lasts 10 lunar months, or nine calendar months and seven days. However, for women with irregular cycles, doctors must confirm the exact gestational age and expected date of delivery on an ultrasound before making any predictions.","Pregnancy Tests,2nd Trimester,3rd Trimester,Regular Cycle,Menstrual Cycle,Gestational Age,Date Of Delivery,how to calculate delivery date,how to calculate how many months pregnant,pregnant,how many weeks pregnant am i calculator by due date,how to calculate due date,how to calculate 9th month of pregnancy,how to check in which month of pregnancy you are?,how many weeks is 6 months pregnant,how many weeks is 8 months pregnant,how many weeks is 7 months pregnant"
210,Im pregnant,2255,8,How do you tell your boss you are pregnant?,Patient,xy_DVjw0jGo,4 years ago,"It is advised to wait until the end of the first trimester (around 13 weeks) before telling your boss you are pregnant, as this is when scans are usually done and there is a better chance of a successful pregnancy. Additionally, it is best to research maternity allowances and read through your contract before informing your boss, as their initial reaction may just be due to them needing time to adjust to managing without you.","health,healthcare,wellness,patient,dr,gp,sarah jarvis,pregnancy,pregnant,work,boss,maternity leave,paternity leave,career"
211,BBC Sport,695612,3761,Messi took our soul - Rio Ferdinand re-lives Champions League nightmares against Barcelona | MESSI,BBC Sport,LqBNRmmCp38,3 months ago,"In this transcript, the speaker is discussing the greatness of Lionel Messi and how he embarrassed them at Wembley and in Rome. The speaker talks about how Messi was unplayable, making quick and effective decisions that their players couldnt keep up with. This caused a feeling of dejection when they lost, which resulted in an unusually wild party as they tried to cope with the disappointment.","BBC,BBC Sport,Highlights,2022,lionel messi,messi,fc barcelona,PSG,argentina,messi documentary,rio ferdinand,halloween,rio,champions league final,2009,roma 2009,wembley 2011,sir alex ferguson,manchester united,barcelona,3-1,2-0,messi goals,marking messi,nightmare,defender,pedro,xavi,andres iniesta,samuel etoo,david villa,pep guardiola,highlights,story,story time,iplayer,bb messi documentary,UCL,champions league,park ji-sung,cristiano ronaldo,vidic,loser"
212,BBC Sport,668062,11850,1983: SEAT BELTS become COMPULSORY | BBC News | Retro Transport | BBC Archive,BBC Archive,950kIPv3f38,3 months ago,"The new law that requires drivers and front seat passengers to wear a seat belt has resulted in an increased number of people using them. However, some police forces have adopted a lenient attitude towards enforcement of the law, with some receiving just a warning instead of being prosecuted. Despite this, figures show that wearing a seat belt decreases the amount of accidents on the road.","bbc,archive bbc,classic tv,british tv nostalgia,bbc archive,archive,the bbc archive,nostalgia,legendary television,retro tv,vintage,bbc news archive,bbc news 1980s,vintage transport,forgotten transport,classic transport,retro transport,past transport,antique transport,seat belt law uk,road safety uk,seat belt law reaction,1980s cars uk,seat belt compulsory,front seat belt compulsory,peter gould bbc,john thorne bbc,uk driving laws,clunk click"
213,BBC Sport,42859,1972,"Elon Musks SpaceX tests Starship, most powerful ever rocket system - BBC News",BBC News,4xyvWJ9jrf0,12 days ago,"SpaceX recently conducted a successful ground test of its Super Heavy booster, consisting of 33 rocket engines, that brings the companys Starship Rocket System one step closer to being able to reach the Moon and Mars. This rocket is twice as powerful as the Saturn V Rocket and NASAs Space Launch System, and will have the capacity to carry up to 100 people or cargo in the future. A test launch is planned for the coming weeks.","bbc,bbc news,news"
214,BBC Sport,5683,1868,I have gravy on pasta! - Chloe Kelly & Lauren Hemp dish the dirt in Honesty Cards | Football Focus,BBC Sport,2dPQg643aG0,4 months ago,"Kelly and Lauren, who are playing honesty cards, discuss their career advice, favourite films and food habits. They also compare Chloe to a strawberry for her sweetness and Keira for having amazing football skills. Kelly reveals her weird habit of putting ketchup on most meals.","BBC,BBC Sport,2022,chloe kelly,lauren hemp,honesty cards,man city,manchester city women,blue moon,raver,team-mates,who likes to party,jo currie,best advice,over thinking,high school musical,songs,biggest party,weights,cardio,running,fruit,funny,quiz,banana,lionesses,england,euro 2022,winners,mcfc,skils,free-kick,Kiera walsh,leah williamson,ketchup,tomato ketchup,brown sauce,student diet,favourite food,weird food,gravy,pasta,get to know,honest answers"
215,BBC Sport,5314,103,Can Liverpool still finish in the Premier Leagues Top Four? | Match of the Day 2,BBC Sport,6wZWjQ03BKs,2 days ago,"The top four of the season is still up in the air, but Manchester United is likely to make it. Liverpool has had two good results and is gaining momentum, although there is some concern over Nunezs shoulder injury. A lot can change in a week, which suggests that the top four teams are not yet set in stone.","BBC,BBC Sport,Highlights,football,soccer,2023,liverpool,liverpool fc,YNWA,LFC,premier league,PL,EPL,match of the day,match of the day 2,MOTD,post match,debate,discussion,top four,top 4,alisson,jurgen klopp,mo salah,cody gakpo,newcastle 0-2 liverpool,reaction,darwin nunez,injuries,champions league,2022-23,diogo jota,roberto firmino,everton,match highlights,analysis,mark chapman,dion dublin,stephen warnock"
216,lanch the ranch,8889998,489463,When they charge extra for ranch 😑🙄😂 #shorts,Matt & Justus,2Ms5HFKw6_4,10 days ago,"The customer is ordering at a restaurant, and keeps getting told that every item he asks for will cost extra, to which he responds I know it sucks. He goes to the bathroom and finds it out of toilet paper, and when he requests some, hes told it will cost extra yet again. He decides to leave without paying his bill.","matt and justus,when they charge extra for ranch,comedy,key and peele,matt josten,justus domenic,justus delgado,matthew josten,timmy josten,ranch,put it on my bill,sure but its gonna cost extra,bathroom,toilet paper,hannah stocking,king bach,trevor wallace,cherdleys,anwar,adamw"
217,lanch the ranch,570281,47623,David Morris - Dutton Ranch Freestyle (Official Music Video),David Morris,YnujskEgHnY,5 months ago,"Last night, a girl the narrator met at a bar said she liked cheap drinks, tattoos, and Morgan Wallen. The narrator responded that he likes late night bonfires, Yellowstone Whiskey Myers, lifted trucks with mud on tires, and living it up in America. He is from West Virginia and is trying to make his mark by being wild and free. He has friends who call him Rip because when they see him they rip (have fun). The girl he met likes cheap drinks","david morris music,david morris,david morris new music,david morris new song,new music david morris,new song david morris,david morris rap,david morris rapping,david morris rapper,david morris singer,southern rap,David,Morris,f350,wild country,heartland,smalltown queen"
218,lanch the ranch,23788,217,Ricky Carmichael Returns to The Ranch,Danny West,XmyQR9HAnkE,2 years ago,"Ricky Carmichael has been racing for 15 years, and it was a thrill to see him back at the track where he first began. His children have never seen him ride before, so it was special for them to experience his return. He feels thankful to have the opportunity to let his kids witness what he has achieved through hard work and dedication.","Motocross,MX,Ricky Carmichael,Monster Energy,Suzuki,Loretta Lynns,The Ranch,GOAT,amateur,Race,Coverage"
219,lanch the ranch,2977,376,Road to Launch with Elizabeth Poett | Magnolia Network,Magnolia Network,I9BEtmvxltU,1 year ago,"Elizabeth Poet lives on Rancho San Julianne, a 14,000-acre working ranch in California that was granted to her great great great great great grandfather in 1837. She loves to share the food she grows and prepares on the ranch with her family, friends, and community. Each episode of Ranch to Table is a unique adventure featuring traditional Santa Maria style barbecue and recipes that explore the philosophy of food and life.","magnolia,chip gaines,chip and jo,waco,magnolia network,joanna gaines,television network"
220,lanch the ranch,2908,77,New Docuseries Launching! Regenerating the Ranch Trailer,Noble Research Institute,Meqd7zMcSso,6 months ago,"In 2020, Noble Research Institute announced their focus on regenerative ranching in order to rebuild healthy soils and grazing lands across the United States. They began with seven research ranches spread over 14,000 acres in southern Oklahoma. Through this journey, they hope to share their challenges and successes as they work to regenerate their land.","agruculture,cattle health,climate change,climate variability,cover crops,cover crops for grazing,cover crops no till,farming,grazing,grazing in the grass,herd health,holistic grazing,pasture land,pasture management,ranching,regenerative,regenerative agriculture,regenerative farming,regenerative ranching,soil health,sustainability,sustainable farming,regenerating the ranch"
221,lanch the ranch,851,142,CHRISTMAS AT THE RANCH 2021 new trailer,Mr.Trailer,ywCmwZoOc2o,1 year ago,This transcript is about someone having a meeting about a crab tweet and needing to consider selling their ranch which is in trouble. They are also discussing Christmas plans and someone has come back to save the day by suggesting they sell to Bert.,"trailer,lesbian,gay,queer,lgbtq,pride,bisexual,lgbtqia,lgbtqtiktoks,lgbtq tik toks,lgbtq trailer,lesbians,wlw,women loving women,movie,film,film trailer,movie trailer 2021,trailers,entertainment,romantic comedy,lgbtq short film,lgbtq film,tv,female filmmaker,queer representation,lgbt music,lgbt,lesbian movies,lesbian films,lgbtq series,lesbian series,christmas,christmas movies,christmas trailers,christmas2021,holiday movies,lgbtq christmas movies,2021"
